"ফেরি থেকে নামার সময় পদদলিত হয়ে পাঁচজনের মৃত্যু","বাংলার সময় ডেস্ক","১২-০৫-২০২১, ১৪:৩১","মৃত্যু, ফেরিঘাট, ফেরি, নৌরুট, মৃত্যু, পাঁচজনের, হয়ে, পদদলিত, সময়, নামার, থেকে, ফেরি, ","মুন্সিগঞ্জের শিমুলিয়া-বাংলাবাজার নৌরুটে দুটি ফেরি থেকে নামার সময় যাত্রীদের প্রচণ্ড ভিড়ে পদদলিত হয়ে পাঁচজনের মৃত্যু হয়েছে। এ সময় আহত হয়েছের আরও ১৫ যাত্রী।

বুধবার (১২ মে) শিমুলিয়া থেকে বাংলাবাজার যাওয়ার পথে শাহ পরান ও এনায়েতপুরী নামে দুটি ফেরিতে এ দুটর্ঘনা ঘটে।... ","মুন্সিগঞ্জের শিমুলিয়া-বাংলাবাজার নৌরুটে দুটি ফেরি থেকে নামার সময় যাত্রীদের প্রচণ্ড ভিড়ে পদদলিত হয়ে পাঁচজনের মৃত্যু হয়েছে। এ সময় আহত হয়েছের আরও ১৫ যাত্রী।

বুধবার (১২ মে) শিমুলিয়া থেকে বাংলাবাজার যাওয়ার পথে শাহ পরান ও এনায়েতপুরী নামে দুটি ফেরিতে এ দুটর্ঘনা ঘটে। এরমধ্যে শাহ পরানে একজন ও এনায়েতপুরীতে চারজন মারা যান।

পুলিশ জানিয়েছে, বেলা পৌনে ১১টায় শিমুলিয়া ফেরিঘাট থেকে প্রায় তিন হাজার যাত্রী নিয়ে শাহ পরান নামের একটি রো রো ফেরি রওনা হয়। ফেরিটি বাংলাবাজার পৌঁছায় দুপুর ১২টায়। ফেরিটি বাংলাবাজার ঘাটের ৩ নম্বর পন্টুনে নোঙর করার সঙ্গে সঙ্গে দ্রুত নামতে গিয়ে হুড়োহুড়ি শুরু করেন যাত্রীরা। যাত্রীদের উপচেপড়া ভিড়ে চাপা পড়ে আনচুর মাদবর (১৫) নামের এক কিশোর মারা যায়। সে শরীয়তপুরের নড়িয়া উপজেলায় কলিকাপ্রসাদ এলাকার গিয়াস উদ্দিন মাদবরের ছেলে। আচনুর তার পরিবারের সঙ্গে ঢাকা থেকে গ্রামের বাড়িতে ফিরছিল।

বাংলাবাজার ট্রাফিক পুলিশের পরিদর্শক গণমাধ্যমকে জানিয়েছেন, মাদারীপুরের বাংলাবাজার ও মুন্সিগঞ্জের শিমুলিয়া নৌপথে চলাচলকারী ফেরি এনায়েতপুরী থেকে নামতে গিয়ে বেলা ২টার দিকে পদদলিত হয়ে চারজন মারা যান। এর আগে দুপুর ১২টার দিকে শাহ পরান ফেরিতে পদদলিত হয়ে একজন মারা গেছে।",https://www.somoynews.tv/pages/details/278379,5,False
"ফেরি থেকে নামার সময় পদদলিত হয়ে পাঁচজনের মৃত্যু","বাংলার সময় ডেস্ক","১২-০৫-২০২১, ১৪:৩১","মৃত্যু, ফেরিঘাট, ফেরি, নৌরুট, মৃত্যু, পাঁচজনের, হয়ে, পদদলিত, সময়, নামার, থেকে, ফেরি, ","মুন্সিগঞ্জের শিমুলিয়া-বাংলাবাজার নৌরুটে দুটি ফেরি থেকে নামার সময় যাত্রীদের প্রচণ্ড ভিড়ে পদদলিত হয়ে পাঁচজনের মৃত্যু হয়েছে। এ সময় আহত হয়েছের আরও ১৫ যাত্রী।

বুধবার (১২ মে) শিমুলিয়া থেকে বাংলাবাজার যাওয়ার পথে শাহ পরান ও এনায়েতপুরী নামে দুটি ফেরিতে এ দুটর্ঘনা ঘটে।... ","মুন্সিগঞ্জের শিমুলিয়া-বাংলাবাজার নৌরুটে দুটি ফেরি থেকে নামার সময় যাত্রীদের প্রচণ্ড ভিড়ে পদদলিত হয়ে পাঁচজনের মৃত্যু হয়েছে। এ সময় আহত হয়েছের আরও ১৫ যাত্রী।

বুধবার (১২ মে) শিমুলিয়া থেকে বাংলাবাজার যাওয়ার পথে শাহ পরান ও এনায়েতপুরী নামে দুটি ফেরিতে এ দুটর্ঘনা ঘটে। এরমধ্যে শাহ পরানে একজন ও এনায়েতপুরীতে চারজন মারা যান।

পুলিশ জানিয়েছে, বেলা পৌনে ১১টায় শিমুলিয়া ফেরিঘাট থেকে প্রায় তিন হাজার যাত্রী নিয়ে শাহ পরান নামের একটি রো রো ফেরি রওনা হয়। ফেরিটি বাংলাবাজার পৌঁছায় দুপুর ১২টায়। ফেরিটি বাংলাবাজার ঘাটের ৩ নম্বর পন্টুনে নোঙর করার সঙ্গে সঙ্গে দ্রুত নামতে গিয়ে হুড়োহুড়ি শুরু করেন যাত্রীরা। যাত্রীদের উপচেপড়া ভিড়ে চাপা পড়ে আনচুর মাদবর (১৫) নামের এক কিশোর মারা যায়। সে শরীয়তপুরের নড়িয়া উপজেলায় কলিকাপ্রসাদ এলাকার গিয়াস উদ্দিন মাদবরের ছেলে। আচনুর তার পরিবারের সঙ্গে ঢাকা থেকে গ্রামের বাড়িতে ফিরছিল।

বাংলাবাজার ট্রাফিক পুলিশের পরিদর্শক গণমাধ্যমকে জানিয়েছেন, মাদারীপুরের বাংলাবাজার ও মুন্সিগঞ্জের শিমুলিয়া নৌপথে চলাচলকারী ফেরি এনায়েতপুরী থেকে নামতে গিয়ে বেলা ২টার দিকে পদদলিত হয়ে চারজন মারা যান। এর আগে দুপুর ১২টার দিকে শাহ পরান ফেরিতে পদদলিত হয়ে একজন মারা গেছে।",https://www.somoynews.tv/pages/details/278379,5,False
"১৩ বছর পর মুখ খুললেন সানিয়া!","খেলার সময় ডেস্ক","১১-০৫-২০২১, ১০:০২","সানিয়া মির্জা, টেবিল টেনিস, টেনিস, #WithMe, #StayHome, সানিয়া!, খুললেন, মুখ, পর, বছর, ১৩, ","বেইজিং অলিম্পিকে মাঝপথ থেকে সরে যাওয়া নিয়ে ১৩ বছর পর মুখ খুললেন ভারতের টেনিস তারকা সানিয়া মির্জা। ২০০৮ সালে বেইজিংয়ে অনুষ্ঠিত অলিম্পিক থেকে মাঝপথ থেকে সরে যেতে হয়েছিল তাকে। যা এখনও মন থেকে মেনে নিতে পারেননি তিনি। 

সম্প্রতি এক ইউটিউব চ্যানেলকে সানিয়া মির্জা... ","বেইজিং অলিম্পিকে মাঝপথ থেকে সরে যাওয়া নিয়ে ১৩ বছর পর মুখ খুললেন ভারতের টেনিস তারকা সানিয়া মির্জা। ২০০৮ সালে বেইজিংয়ে অনুষ্ঠিত অলিম্পিক থেকে মাঝপথ থেকে সরে যেতে হয়েছিল তাকে। যা এখনও মন থেকে মেনে নিতে পারেননি তিনি। 

সম্প্রতি এক ইউটিউব চ্যানেলকে সানিয়া মির্জা বলেছেন, প্রত্যেক ক্রীড়াবিদ দেশের হয়ে খেলতে নামলে সেরাটা দেওয়ার চেষ্টা করে। আমিও সেই মানসিকতা নিয়ে বেইজিং অলিম্পিকে শুরু করতে চেয়েছিলাম। কিন্তু ডান হাতের কব্জির যন্ত্রণা খুব ভোগাতে শুরু করে। তখন আমার মাত্র ২০ বছর বয়স। সে বারের চোট আমাকে মানসিকভাবে অনেক পিছনে ঠেলে দেয়। শুধু কাঁদতাম। প্রায় এক মাস খাওয়া-দাওয়া বন্ধ করে দিয়েছিলাম। প্রায় তিন-চার মাস নিজেকে ঘরবন্দি করে রাখার জন্য মানসিক অবসাদে চলে গিয়েছিলাম।

তিনি আরও বলেন, মানুষের জীবনে এমন অনেক ঘটনা ঘটে থাকে যেগুলোর উপর আমাদের নিয়ন্ত্রণ থাকে না। এখন বয়স বেড়েছে। তাই মনে হয় তখন অবসাদে চলে গিয়ে নিজের ক্ষতি না করলেও চলত। আসলে কম বয়সে পরিচিতি পেয়ে যাওয়ার জন্য সবাই বাড়তি আশা করেছিল। সেটা পূরণ করতে না পারার জন্যই হয়তো এতটা বাড়াবাড়ি করে ফেলেছিলাম।

সূত্র: আনন্দবাজার পত্রিকা",https://www.somoynews.tv/pages/details/278156,5,True
